{
  "$schema": "../docs/schemas/strict/agent-workflow.schema.json",
  "schemaVersion": 1,
  "trunk": "master",
  "deliveryBranch": "preview",
  "directPreview": {
    "allowed": true,
    "prepareCommand": "preview:prepare",
    "pushCommand": "preview:push",
    "confirmation": "exact-head-after-human-confirmation",
    "reviewName": "Buggpass",
    "reviewTiming": "before-push",
    "remoteChecks": "after-push"
  },
  "allowedBranchPrefixes": [],
  "branchPrefixExemptActors": ["dependabot[bot]"],
  "immutableRemoteBranchPatterns": ["*BRA*", "rescue/*"],
  "protectedBranchPatterns": [
    "master",
    "main",
    "preview",
    "*BRA*",
    "rescue/*",
    "dependabot/*",
    "archive/*"
  ],
  "directMaster": {
    "allowed": true,
    "breakGlassFlag": "SAJTMASKIN_BREAK_GLASS",
    "breakGlassReason": "SAJTMASKIN_BREAK_GLASS_REASON"
  },
  "requiredChecks": [
    "quality",
    "backoffice-tests",
    "schema-drift",
    "build",
    "dossier-acceptance"
  ],
  "requiredCheckOwners": {
    "quality": "ci.yml",
    "backoffice-tests": "ci.yml",
    "schema-drift": "ci.yml",
    "build": "ci.yml",
    "dossier-acceptance": "dossier-acceptance.yml"
  },
  "ownerReviewPathPrefixes": [
    ".cursor/rules/pr-merge.mdc",
    ".github/workflows/",
    "scripts/ci/",
    "scripts/workflow/check-contract.mjs",
    "scripts/workflow/required-check-owners.mjs",
    "scripts/workflow/ci-scope.mjs",
    "scripts/workflow/path-impact.mjs",
    "config/agent-workflow.json",
    "config/control-plane/policy-registry.json",
    "config/control-plane/schema-registry.json",
    "config/backoffice/domain-map.json"
  ],
  "review": {
    "requiredCheckWorkflow": {
      "path": ".github/workflows/ci.yml",
      "event": "pull_request"
    },
    "qualifyingCheckPatterns": [
      "trusted-pr-ai-review",
      "agent review",
      "find critical bugs",
      "bugbot",
      "codex"
    ],
    "trustedAccountReviewActors": ["Jakeminator123"],
    "securityVetoCheckPatterns": ["gitguardian"],
    "deploymentCheckNames": ["Vercel"]
  },
  "protectedPaths": [
    ".github/**",
    "package.json",
    "package-lock.json",
    ".node-version",
    "AGENTS.md",
    ".agents/skills/**",
    ".codex/**",
    ".cursor/rules/**",
    ".cursor/hooks/**",
    ".cursor/hooks.json",
    ".cursor/**",
    "config/agent-workflow.json",
    "docs/schemas/**",
    "docs/decisions/**",
    "BUG-SWARM-BACKLOG.md",
    "src/app/api/**",
    "src/lib/api/**",
    "src/lib/auth/**",
    "src/lib/db/**",
    "src/lib/gen/**",
    "src/lib/models/**",
    "src/lib/providers/**",
    "src/lib/integrations/**",
    "scripts/db/**",
    "drizzle/**",
    "config/env-policy.json",
    "**/migrations/**"
  ],
  "pathGroups": {
    "docs": ["**/*.md", "**/*.mdx", "docs/**"],
    "controlPlane": ["docs/schemas/**", "config/control-plane/**", "config/backoffice/**"],
    "agent": [
      "AGENTS.md",
      ".agents/**",
      ".codex/**",
      ".cursor/**",
      ".cursorignore",
      ".cursorindexingignore",
      ".gitignore",
      ".worktreeinclude",
      "config/agent-workflow.json",
      "scripts/dev/check-agent-context-budget.mjs",
      "scripts/workflow/**"
    ],
    "runtime": [
      "src/**",
      "tests/**",
      "e2e/**",
      "backoffice/**",
      "scripts/**",
      "preview-host/**",
      "public/**",
      "infra/**",
      "drizzle/**",
      "data/openclaw/**",
      "config/**",
      "*.config.js",
      "*.config.mjs",
      "*.config.ts",
      "tsconfig*.json",
      "vercel.json",
      "knip.json",
      ".node-version",
      "package.json",
      "package-lock.json",
      "requirements*.txt",
      "sajtmaskin_backoffice.py"
    ],
    "backoffice": [
      "backoffice/**",
      "scripts/template_curator/**",
      "sajtmaskin_backoffice.py",
      "requirements.backoffice*.txt"
    ],
    "database": [
      "src/lib/db/**",
      "scripts/db/**",
      "drizzle/**",
      "requirements.dbtest.txt",
      "**/migrations/**"
    ],
    "dependencies": [
      "package.json",
      "package-lock.json",
      "preview-host/package.json",
      "requirements*.txt",
      ".node-version"
    ],
    "ci": [".github/**", "scripts/ci/**"],
    "previewHost": ["preview-host/**"],
    "observability": ["scripts/observability/**", "requirements.genlogs.txt"],
    "e2e": ["e2e/**", "playwright*.config.ts"]
  },
  "verificationProfiles": {
    "always": ["workflow:contract", "test:discovery:check"],
    "docs": [
      "docs:check",
      "docs:links",
      "docs:test",
      "plans:history:check",
      "check:terms:contract"
    ],
    "controlPlane": ["control-plane:check"],
    "agent": ["check:agent-context"],
    "runtime": ["embeddings:ensure", "typecheck", "lint", "test:ci"],
    "backoffice": ["backoffice:test"],
    "database": ["db:schema-drift", "db:blob-sync-unit"],
    "dependencies": ["baseline-deps:verify", "baseline-deps:tree"],
    "ci": ["typecheck", "test:ci"],
    "previewHost": ["preview-host:verify"],
    "observability": ["observability:test"],
    "e2e": ["test:e2e:contract"],
    "full": [
      "lint",
      "scaffolds:validate",
      "dossiers:validate-all",
      "route-timeouts:check",
      "check:bug-backlog",
      "canvas:check",
      "knip:files"
    ]
  }
}
